finding_id,project,criterion,checker,file,line,quote,flagged_defect,suggested_fix,subtype_hidden,verdict[real|style|wrong],note
fnd_cf48bcb33bf4,AP1_Go_T01.ID_1375359-master,readability,spelling_wording_checker,README_RUS.md,135,"1) Программа определяет, сколько раз каждое слово встречается в строке.",Неудачная формулировка: «сколько раз» лучше согласовать с последующим перечислением действий и сделать предложение более естественным.,"Программа определяет, сколько раз встречается каждое слово в строке.",wording,,
fnd_718c07685e2a,AP1_Go_T01.ID_1375359-master,readability,spelling_wording_checker,check-list_RUS.yml,155,специализация врача и дата визита,Ошибка падежного согласования в перечислении.,Заменить «и дата визита» на «и дату визита».,case,,
fnd_6b095e6a5262,AP1_Go_T01.ID_1375359-master,readability,spelling_wording_checker,README_RUS.md,203,специализация врача и дата визита,Ошибка падежного согласования в перечислении.,Заменить «и дата визита» на «и дату визита».,case,,
fnd_16c0fe2dd0f5,AP1_Jv_T04B.ID_1421426-master,readability,spelling_wording_checker,README.md,59,"an ""Unauthorized"" response",Кавычки вокруг названия статуса оформлены неудачно в тексте на английском.,Заменить на: «an Unauthorized response»,quote_style,,
fnd_c49a7d81215f,AP1_Go_T01.ID_1375359-master,readability,spelling_wording_checker,README_RUS.md,45,компилируемый многопоточный язык,Формулировка про многопоточность языка звучит неточно и может сбивать студента.,Заменить на «компилируемый язык программирования с поддержкой конкурентности».,wording,,
fnd_327bc74dc973,AP1_Go_T01.ID_1375359-master,readability,spelling_wording_checker,check-list_RUS.yml,125,завершить нажатие нужно нажатием Enter,Тавтология: «нажатие нужно нажатием».,Заменить на «завершить ввод нужно нажатием Enter».,tautology,,
fnd_bdf60ed83b13,AP1_Go_T02.ID_1375360-master,readability,spelling_wording_checker,README_RUS.md,81,Параметры `K` и `N` задаются через аргументы при вызове программы.,Неудачная формулировка: «через аргументы при вызове программы» звучит громоздко и тавтологично.,Параметры `K` и `N` задаются аргументами при вызове программы.,wording,,
fnd_4064e240ad48,AP1_Go_T01.ID_1375359-master,readability,spelling_wording_checker,README_RUS.md,35,проект необходимо склонировать,Нарушено согласование: слово «проект» должно быть в нужном падеже при управлении «перед выполнением».,Перед выполнением проекта необходимо склонировать его с GitLab в одноимённый репозиторий.,case,,
fnd_75cd8659ab78,CbS11_Enterprise_IT_landscape.ID_1573765-master,readability,spelling_wording_checker,README.md,27,вокруг тебя такие же пиры,Слово употреблено с опечаткой: вместо нужного слова написано другое.,вокруг тебя такие же пэры,typo,,
fnd_441e3994e4f6,AP1_Go_T02.ID_1375360-master,readability,spelling_wording_checker,README.md,131,"If capacity is exceeded, rarely used items should be evicted.","Смысл почти дублирует предыдущий пункт, из-за чего возникает тавтология.","объединить с предыдущим пунктом или переформулировать, например: «If capacity is exceeded, the least recently used item is evicted.»",tautology,,
fnd_65cfc9e289de,AP1_Jv_T04B.ID_1421426-master,readability,spelling_wording_checker,README_RUS.md,98,Опиши Bean для получения SecurityFilterChain.,Слово «Bean» лучше привести к русской форме или единообразию с остальным текстом.,Опиши bean для получения SecurityFilterChain.,wording,,
